{
	"$schema": "http://json-schema.org/draft-04/schema#",
	"type": "object",
	"additionalProperties": false,
	"properties": {
		"aliasing" : {
			"type" : "array",
			"uniqueItems" : true,
			"items" : {
				"type" : "object",
				"properties": {
					"name" : {
						"type" : "string"
					},
					"deprecation" : {
						"type" : "boolean"
					},
					"target" : {
						"type" : "string"
					}
				},
				"required" : [
					"name", "target"
				]
			}
		},
		"item": {
			"type": "object",
			"additionalProperties": false,
			"properties": {
				"data": {
					"type": "object",
					"additionalProperties": false,
					"properties": {
						"content": {
							"type": "object",
							"additionalProperties": false,
							"properties": {
								"file": {
									"type": [
										"null", "string"
									]
								},
								"seed": {
									"type": "string",
									"pattern" : "[A-Fa-f0-9]+"
								},
								"ring" : {
									"type" : "object",
									"additionalProperties" : false,
									"required" : [
										"cache", "size"
									],
									"properties" : {
										"cache" : {
											"type" : "integer",
											"minimum" : 1
										},
										"size" : {
											"oneOf" : [
												{
													"type": "integer",
													"minimum" : 1
												},
												{
													"type" : "string",
													"pattern" : "[\\d\\.]+[KMGTPE]?B?"
												}
											]
										}
									}
								}
							},
							"required": [
								"file", "seed", "ring"
							]
						}
					},
					"required": [
						"content"
					]
				},
				"input": {
					"type": "object",
					"additionalProperties": false,
					"properties": {
						"file": {
							"type": [
								"null", "string"
							]
						},
						"path": {
							"type": [
								"null", "string"
							]
						}
					},
					"required": [
						"file", "path"
					]
				},
				"naming": {
					"type": "object",
					"additionalProperties": false,
					"properties": {
						"type": {
							"type": "string",
							"enum" : [
								"asc", "desc", "random"
							]
						},
						"prefix": {
							"type": [
								"null", "string"
							]
						},
						"radix": {
							"type": "integer",
							"minimum" : 2,
							"maximum" : 36
						},
						"offset": {
							"type": "integer",
							"minimum" : 0
						},
						"length": {
							"type": "integer",
							"minimum" : 1
						}
					},
					"required": [
						"type", "prefix", "radix", "offset", "length"
					]
				},
				"output": {
					"type": "object",
					"additionalProperties": false,
					"properties": {
						"delay" : {
							"oneOf" : [
								{
									"type" : "integer",
									"minimum" : 0
								},
								{
									"type" : "string",
									"pattern" : "[\\d]+[SsMmHhDd]?"
								}
							]
						},
						"file": {
							"type": [
								"null", "string"
							]
						},
						"path": {
							"type": [
								"null", "string"
							]
						}
					},
					"required": [
						"delay", "file", "path"
					]
				},
				"type" : {
					"enum" : [
						"data", "path", "token"
					]
				}
			},
			"required": [
				"data", "input", "naming", "output"
			]
		},
		"storage": {
			"type": "object",
			"additionalProperties": false,
			"properties": {
				"auth": {
					"type": "object",
					"additionalProperties": false,
					"properties": {
						"file": {
							"type" : [
								"null", "string"
							]
						},
						"secret": {
							"type": [
								"null", "string"
							]
						},
						"token": {
							"type": [
								"null", "string"
							]
						},
						"uid": {
							"type" : [
								"null", "string"
							]
						}
					},
					"required": [
						"file", "secret", "token", "uid"
					]
				},
				"mock": {
					"type": "object",
					"additionalProperties": false,
					"properties": {
						"capacity": {
							"type": "integer",
							"minimum" : 0
						},
						"container": {
							"type": "object",
							"properties": {
								"capacity": {
									"type": "integer",
									"minimum" : 0
								},
								"countLimit": {
									"type": "integer",
									"minimum" : 0
								}
							},
							"required": [
								"capacity", "countLimit"
							]
						},
						"fail" : {
							"type" : "object",
							"additionalProperties" : false,
							"properties" : {
								"connections" : {
									"type" : "integer",
									"minimum" : 0
								},
								"responses" : {
									"type" : "integer",
									"minimum" : 0
								}
							},
							"required" : [
								"connections", "responses"
							]
						},
						"node" : {
							"type" : "boolean"
						}
					},
					"required": [
						"capacity", "container", "fail", "node"
					]
				},
				"net" : {
					"type" : "object",
					"additionalProperties" : false,
					"properties" : {
						"bindBacklogSize": {
							"type": "integer",
							"minimum" : 0
						},
						"interestOpQueued": {
							"type": "boolean"
						},
						"keepAlive": {
							"type": "boolean"
						},
						"linger": {
							"type": "integer",
							"minimum" : 0
						},
						"rcvBuf" : {
							"oneOf" : [
								{
									"type" : "integer",
									"minimum" : 0
								},
								{
									"type" : "string",
									"pattern" : "[\\d\\.]+[KMGTPE]?B?"
								}
							]
						},
						"reuseAddr": {
							"type": "boolean"
						},
						"sndBuf" : {
							"oneOf" : [
								{
									"type" : "integer",
									"minimum" : 0
								},
								{
									"type" : "string",
									"pattern" : "[\\d\\.]+[KMGTPE]?B?"
								}
							]
						},
						"tcpNoDelay": {
							"type": "boolean"
						},
						"timeoutMilliSec": {
							"type": "integer",
							"minimum" : 0
						},
						"ssl" : {
							"type" : "boolean"
						},
						"http": {
							"type": "object",
							"additionalProperties": false,
							"properties": {
								"fsAccess": {
									"type": "boolean"
								},
								"headers": {
									"type": "object",
									"properties": {
									}
								},
								"namespace": {
									"type": [
										"null",
										"string"
									]
								},
								"versioning": {
									"type": "boolean"
								}
							},
							"required": [
								"fsAccess", "headers", "namespace", "versioning"
							]
						},
						"node" : {
							"type" : "object",
							"additionalProperties" : false,
							"properties" : {
								"port" : {
									"type" : "number",
									"minimum" : 1
								}
							},
							"required" : [
								"port"
							]
						}
					},
					"required" : [
						"bindBacklogSize", "interestOpQueued", "keepAlive", "linger",
						"rcvBuf", "reuseAddr", "sndBuf", "tcpNoDelay", "timeoutMilliSec", "ssl",
						"http", "node"
					]
				}
			},
			"required": [
				"auth", "mock"
			]
		},
		"test" : {
			"type" : "object",
			"required" : [
				"step"
			],
			"additionalProperties" : false,
			"properties" : {
				"step" : {
					"type" : "object",
					"required" : [
						"limit", "metrics", "name"
					],
					"additionalProperties" : false,
					"properties" : {
						"limit" : {
							"type": "object",
							"additionalProperties": false,
							"properties": {
								"count": {
									"type": "integer",
									"minimum" : 0
								},
								"rate": {
									"type": "number",
									"minimum" : 0
								},
								"size": {
									"oneOf" : [
										{
											"type": "integer",
											"minimum" : 0
										},
										{
											"type" : "string",
											"pattern" : "[\\d\\.]+[KMGTPE]?B?\\-?[\\d\\.]?[KMGTPE]?B?"
										}
									]
								},
								"time": {
									"oneOf" : [
										{
											"type" : "integer",
											"minimum" : 0
										},
										{
											"type" : "string",
											"pattern" : "[\\d]+[SsMmHhDd]?"
										}
									]
								}
							},
							"required": [
								"count", "rate", "size", "time"
							]
						},
						"metrics" : {
							"type" : "object",
							"required" : [
								"period", "threshold"
							],
							"additionalProperties" : false,
							"properties" : {
								"period" : {
									"oneOf" : [
										{
											"type" : "integer",
											"minimum" : 0
										}, {
											"type" : "string",
											"pattern" : "[\\d]+[SsMmHhDd]?"
										}
									]
								},
								"threshold" : {
									"type" : "number",
									"minimum" : 0,
									"maximum" : 1
								}
							}
						},
						"name" : {
							"type" : [
								"null", "string"
							]
						}
					}
				}
			}
		},
		"version" : {
			"type" : "string"
		}
	},
	"required": [
		"item",
		"storage",
		"test",
		"version"
	]
}
