{
	"item" : {
		"data" : {
			"content" : {
				"file" : null,
				"seed" : "7a42d9c483244167",
				"ring" : {
					"cache" : 25,
					"size" : "4MB"
				}
			}
		},
		"input" : {
			"file" : null,
			"path" : null
		},
		"naming" : {
			"type" : "random",
			"prefix" : null,
			"radix" : 36,
			"offset" : 0,
			"length" : 12
		},
		"output" : {
			"delay" : 0,
			"file" : null,
			"path" : null
		}
	},
	"storage" : {
		"auth" : {
			"file" : null,
			"secret" : null,
			"token" : null,
			"uid" : null
		},
		"mock" : {
			"capacity" : 1000000,
			"container" : {
				"capacity" : 1000000,
				"countLimit" : 1000000
			},
			"fail" : {
				"connections" : 0,
				"responses" : 0
			},
			"node": false
		},
		"net" : {
			"bindBacklogSize" : 0,
			"interestOpQueued" : false,
			"keepAlive" : true,
			"linger" : 0,
			"reuseAddr" : true,
			"rcvBuf" : 0,
			"sndBuf" : 0,
			"tcpNoDelay" : true,
			"timeoutMilliSec" : 0,
			"ssl" : false,
			"http" : {
				"fsAccess" : false,
				"headers" : {
					"Connection" : "Keep-Alive",
					"User-Agent" : "nagaina/3.6.10"
				},
				"namespace" : null,
				"versioning" : false
			},
			"node": {
				"port" : 9020
			}
		}
	},
	"test" : {
		"step" : {
			"limit" : {
				"count" : 0,
				"rate" : 0,
				"size" : 0,
				"time" : "0s"
			},
			"metrics" : {
				"period" : "10s",
				"threshold" : 0
			},
			"name" : null
		}
	},
	"version" : "3.6.10",
	"aliasing" : [
		{
			"name" : "run-id",
			"deprecated" : true,
			"target" : "test-step-name"
		},
		{
			"name" : "atmos-subtenant",
			"target" : "storage-auth-token"
		},
		{
			"name" : "s3-input-bucket",
			"target" : "item-input-path"
		},
		{
			"name" : "s3-output-bucket",
			"target" : "item-output-path"
		},
		{
			"name" : "swift-input-container",
			"target" : "item-input-path"
		},
		{
			"name" : "swift-output-container",
			"target" : "item-output-path"
		},
		{
			"name" : "socket-bindBacklogSize",
			"deprecated" : true,
			"target" : "storage-net-bindBacklogSize"
		},
		{
			"name" : "socket-interestOpQueued",
			"deprecated" : true,
			"target" : "storage-net-interestOpQueued"
		},
		{
			"name" : "socket-keepAlive",
			"deprecated" : true,
			"target" : "storage-net-keepAlive"
		},
		{
			"name" : "socket-linger",
			"deprecated" : true,
			"target" : "storage-net-linger"
		},
		{
			"name" : "socket-reuseAddr",
			"deprecated" : true,
			"target" : "storage-net-reuseAddr"
		},
		{
			"name" : "socket-rcvBuf",
			"deprecated" : true,
			"target" : "storage-net-rcvBuf"
		},
		{
			"name" : "socket-sndBuf",
			"deprecated" : true,
			"target" : "storage-net-sndBuf"
		},
		{
			"name" : "socket-tcpNoDelay",
			"deprecated" : true,
			"target" : "storage-net-tcpNoDelay"
		},
		{
			"name" : "socket-timeoutMilliSec",
			"deprecated" : true,
			"target" : "storage-net-timeOutMilliSec"
		},
		{
			"name" : "storage-ssl",
			"deprecated" : true,
			"target" : "storage-net-ssl"
		},
		{
			"name" : "storage-http-api",
			"deprecated" : true,
			"target" : "storage-driver-type"
		},
		{
			"name" : "socket-http-fsAccess",
			"deprecated" : true,
			"target" : "storage-net-http-fsAccess"
		},
		{
			"name" : "storage-http-headers",
			"deprecated" : true,
			"target" : "storage-net-http-headers"
		},
		{
			"name" : "storage-http-namespace",
			"deprecated" : true,
			"target" : "storage-net-http-namespace"
		},
		{
			"name" : "storage-http-versioning",
			"deprecated" : true,
			"target" : "storage-net-http-versioning"
		},
		{
			"name" : "storage-node-port",
			"deprecated" : true,
			"target" : "storage-net-node-port"
		},
		{
			"name" : "load-job-name",
			"deprecated" : true,
			"target" : "test-step-name"
		},
		{
			"name" : "load-limit-count",
			"deprecated" : true,
			"target" : "test-step-limit-count"
		},
		{
			"name" : "load-limit-rate",
			"deprecated" : true,
			"target" : "test-step-limit-rate"
		},
		{
			"name" : "load-limit-size",
			"deprecated" : true,
			"target" : "test-step-limit-size"
		},
		{
			"name" : "load-limit-time",
			"deprecated" : true,
			"target" : "test-step-limit-time"
		},
		{
			"name" : "load-metrics-period",
			"deprecated" : true,
			"target" : "test-step-metrics-period"
		},
		{
			"name" : "load-metrics-precondition",
			"deprecated" : true,
			"target" : "test-step-precondition"
		},
		{
			"name" : "load-metrics-threshold",
			"deprecated" : true,
			"target" : "test-step-metrics-threshold"
		},
		{
			"name" : "storage-auth-id",
			"deprecated" : true,
			"target" : "storage-auth-uid"
		}
	]
}
